{
  "name": "London Heathrow Airport",
  "lat": 51.4706,
  "lon": -0.4619,
  "elevation": 83.0,
  "country": {
    "code": "GB",
    "name": "United Kingdom"
  },
  "city": "London",
  "state": "England",
  "timezone": {
    "name": "Europe/London",
    "offset": 0
  },
  "iata": "LHR",
  "icao": "EGLL",
  "runways": [
    {
      "designator": "27L/09R",
      "heading": 270,
      "length": 3901,
      "width": 60,
      "elevation": 83,
      "thr_coordinates": [51.4656, -0.4875],
      "surface": {
        "type": "ASPH",
        "description": "Asphalt"
      }
    },
    {
      "designator": "27R/09L",
      "heading": 270,
      "length": 3658,
      "width": 60,
      "elevation": 79,
      "thr_coordinates": [51.4777, -0.4875],
      "surface": {
        "type": "ASPH",
        "description": "Asphalt"
      }
    }
  ]
}
